{
  "schema_version": "1.0",
  "artifact_id": "artifact-1",
  "artifact_type": "evidence",
  "tenant_id": "acme",
  "storage_path": "tenants/acme/evidence/artifact-1.json",
  "owner": { "tenant_id": "acme", "subject_id": "sub-1" },
  "source": { "tenant_id": "acme", "task_id": "task-1", "run_id": "run-1", "revision": "rev-1", "digest": "sha256:aaaaaaaaaaaaaaaaaaaaaaaaaaaaaaaaaaaaaaaaaaaaaaaaaaaaaaaaaaaaaaaa" },
  "pii_classification": "none",
  "retention": { "policy_ref": "F1-05:user-owned", "status": "pending_user_decision" },
  "deletion": { "state": "active" },
  "legal_hold": { "state": "none", "reference": null },
  "dsar": { "correlation_id": "dsar-none-artifact-1", "status": "none" },
  "access": { "isolation_scope": "tenant", "tenant_id": "acme", "authorized_roles": ["security_reviewer"], "metadata_source": "flue-pi-platform-gateway" },
  "integrity": { "content_digest": "sha256:bbbbbbbbbbbbbbbbbbbbbbbbbbbbbbbbbbbbbbbbbbbbbbbbbbbbbbbbbbbbbbbb", "immutable": true, "version": 1, "created_at": "2026-07-13T12:00:00Z" }
}
